{
  "dataset_id": "commerce-combined-coverage",
  "version": "1.0.0",
  "metadata": {
    "domain": "commerce",
    "difficulty": "mixed",
    "tags": [
      "coverage",
      "combined"
    ]
  },
  "conversations": [
    {
      "conversation_id": "conv-9wtj",
      "turns": [
        {
          "role": "user",
          "text": "My order arrived damaged. I want a refund."
        },
        {
          "role": "assistant",
          "text": "I am sorry to hear that. Could you share your order ID and item details?"
        },
        {
          "role": "user",
          "text": "Order #A123, item: headphones, price $79."
        },
        {
          "role": "assistant",
          "text": "Based on the policy, we can process a refund if damage is confirmed."
        },
        {
          "role": "user",
          "text": "Thanks, what can you do for me now?"
        },
        {
          "role": "assistant",
          "text": "I have approved a full refund of $79."
        }
      ]
    },
    {
      "conversation_id": "conv-jcen",
      "turns": [
        {
          "role": "user",
          "text": "My order arrived damaged. I want a refund."
        },
        {
          "role": "assistant",
          "text": "I am sorry to hear that. Could you share your order ID and item details?"
        },
        {
          "role": "user",
          "text": "Order #A123, item: headphones, price $79."
        },
        {
          "role": "assistant",
          "text": "Based on the policy, we can process a refund if damage is confirmed."
        },
        {
          "role": "user",
          "text": "Thanks, what can you do for me now?"
        },
        {
          "role": "assistant",
          "text": "We cannot refund without proof of damage. Please provide photos."
        }
      ]
    },
    {
      "conversation_id": "conv-6ret",
      "turns": [
        {
          "role": "user",
          "text": "My order arrived damaged. I want a refund."
        },
        {
          "role": "assistant",
          "text": "I am sorry to hear that. Could you share your order ID and item details?"
        },
        {
          "role": "user",
          "text": "Order #A123, item: headphones, price $79."
        },
        {
          "role": "assistant",
          "text": "Based on the policy, we can process a refund if damage is confirmed."
        },
        {
          "role": "user",
          "text": "Thanks, what can you do for me now?"
        },
        {
          "role": "assistant",
          "text": "I can offer a partial refund of $40."
        }
      ]
    },
    {
      "conversation_id": "conv-h1pw",
      "turns": [
        {
          "role": "user",
          "text": "My order arrived damaged. I want a refund."
        },
        {
          "role": "assistant",
          "text": "I am sorry to hear that. Could you share your order ID and item details?"
        },
        {
          "role": "user",
          "text": "Order #A123, item: headphones, price $79."
        },
        {
          "role": "assistant",
          "text": "Based on the policy, we can process a refund if damage is confirmed."
        },
        {
          "role": "user",
          "text": "Thanks, what can you do for me now?"
        },
        {
          "role": "assistant",
          "text": "I have approved a full refund of $79."
        }
      ]
    },
    {
      "conversation_id": "conv-kfcx",
      "turns": [
        {
          "role": "user",
          "text": "My order arrived damaged. I want a refund."
        },
        {
          "role": "assistant",
          "text": "I am sorry to hear that. Could you share your order ID and item details?"
        },
        {
          "role": "user",
          "text": "Order #A123, item: headphones, price $79."
        },
        {
          "role": "assistant",
          "text": "Based on the policy, we can process a refund if damage is confirmed."
        },
        {
          "role": "user",
          "text": "Thanks, what can you do for me now?"
        },
        {
          "role": "assistant",
          "text": "We cannot refund without proof of damage. Please provide photos."
        }
      ]
    },
    {
      "conversation_id": "conv-8b9y",
      "turns": [
        {
          "role": "user",
          "text": "My order arrived damaged. I want a refund."
        },
        {
          "role": "assistant",
          "text": "I am sorry to hear that. Could you share your order ID and item details?"
        },
        {
          "role": "user",
          "text": "Order #A123, item: headphones, price $79."
        },
        {
          "role": "assistant",
          "text": "Based on the policy, we can process a refund if damage is confirmed."
        },
        {
          "role": "user",
          "text": "Thanks, what can you do for me now?"
        },
        {
          "role": "assistant",
          "text": "I can offer a partial refund of $40."
        }
      ]
    },
    {
      "conversation_id": "conv-75nu",
      "turns": [
        {
          "role": "user",
          "text": "My order arrived damaged. I want a refund."
        },
        {
          "role": "assistant",
          "text": "I am sorry to hear that. Could you share your order ID and item details?"
        },
        {
          "role": "user",
          "text": "Order #A123, item: headphones, price $79."
        },
        {
          "role": "assistant",
          "text": "Based on the policy, we can process a refund if damage is confirmed."
        },
        {
          "role": "user",
          "text": "Thanks, what can you do for me now?"
        },
        {
          "role": "assistant",
          "text": "I have approved a full refund of $79."
        }
      ]
    },
    {
      "conversation_id": "conv-3y0j",
      "turns": [
        {
          "role": "user",
          "text": "My order arrived damaged. I want a refund."
        },
        {
          "role": "assistant",
          "text": "I am sorry to hear that. Could you share your order ID and item details?"
        },
        {
          "role": "user",
          "text": "Order #A123, item: headphones, price $79."
        },
        {
          "role": "assistant",
          "text": "Based on the policy, we can process a refund if damage is confirmed."
        },
        {
          "role": "user",
          "text": "Thanks, what can you do for me now?"
        },
        {
          "role": "assistant",
          "text": "We cannot refund without proof of damage. Please provide photos."
        }
      ]
    },
    {
      "conversation_id": "conv-fr58",
      "turns": [
        {
          "role": "user",
          "text": "My order arrived damaged. I want a refund."
        },
        {
          "role": "assistant",
          "text": "I am sorry to hear that. Could you share your order ID and item details?"
        },
        {
          "role": "user",
          "text": "Order #A123, item: headphones, price $79."
        },
        {
          "role": "assistant",
          "text": "Based on the policy, we can process a refund if damage is confirmed."
        },
        {
          "role": "user",
          "text": "Thanks, what can you do for me now?"
        },
        {
          "role": "assistant",
          "text": "I can offer a partial refund of $40."
        }
      ]
    }
  ]
}