{
  "dataset_id": "demo",
  "version": "1.0.0",
  "metadata": { "domain": "commerce", "difficulty": "easy", "tags": ["sample"] },
  "conversations": [
    {
      "conversation_id": "conv1",
      "turns": [
        {"role": "user", "text": "I want a refund for order A1"},
        {"role": "assistant", "text": "Please share the order ID."},
        {"role": "user", "text": "Order ID is A1."}
      ]
    }
  ]
}